<?xml version="1.0" ?>
<xs:schema xmlns:xs="http://www.w3.org/2001/XMLSchema">
    <xs:element name="receptes">
        <xs:complexType>
            <xs:sequence>
                <xs:element  name="recepta" maxOccurs="10">
                    <xs:complexType>
                        <xs:sequence>
                            <xs:element name="autor">
                                <xs:complexType>
                                    <xs:sequence>
                                        <xs:element name="nom" type="xs:string"/>
                                        <xs:element name="dni" type="xs:string"/>
                                    </xs:sequence>
                                </xs:complexType>
                            </xs:element>
                            <xs:element name="nom" type="xs:string"/>
                            <xs:element name="ingredients">
                                <xs:complexType>
                                    <xs:sequence>
                                        <xs:element name="ingredient">
                                            <xs:complexType>
                                                <xs:sequence>
                                                    <xs:element name="quantitat">
                                                        <xs:complexType>
                                                            <xs:sequence>
                                                                <xs:element name="valor" type="xs:integer"/>
                                                                <xs:element name="mesura" type="xs:string"/>
                                                            </xs:sequence>
                                                        </xs:complexType>
                                                    </xs:element>
                                                    <xs:element name="nom" type="xs:string"/>
                                                </xs:sequence>
                                            </xs:complexType>
                                        </xs:element>
                                    </xs:sequence>
                                </xs:complexType>
                            </xs:element>
                            <xs:element name="passos">
                                <xs:complexType>
                                    <xs:sequence>
                                        <xs:element name="pas" type="xs:string"/>
                                    </xs:sequence>
                                </xs:complexType>
                            </xs:element>
                        </xs:sequence>
                        <xs:attribute name="dificultat" type="xs:integer" use="required"/>
                    </xs:complexType>
                </xs:element>
            </xs:sequence>
        </xs:complexType>
    </xs:element>
</xs:schema>