<receptes xmlns:xsi="http://www.w3.org/2001/XMLSchema-instance"
          xsi:noNamespaceSchemaLocation="kerly.guanoquiza.7e8.xsd">
    <recepta dificultat="5">
        <autor>
            <nom>Marc Iba√±ez</nom>
            <dni>45784548F</dni>
        </autor>
        <nom>Patates amb llet</nom>
        <ingredients>
            <ingredient>
                <quantitat>
                    <valor>2</valor>
                    <mesura>grams</mesura>
                </quantitat>
                <nom>all</nom>
            </ingredient>
        </ingredients>
        <passos>
            <pas>Fregir patates</pas>
        </passos>
    </recepta>
</receptes>